<?xml version="1.0"?>
<!--
 Autor.- Elena de AntÃ³n
 Fecha.- 21/03/2020
 Documento.- 05.xsd
-->

<xs:schema version="1.0"
           xmlns:xs="http://www.w3.org/2001/XMLSchema"
           elementFormDefault="qualified">
           
    <xs:element name="garaje">
        <xs:complexType>
            <xs:sequence>
                <xs:element name="coches">
                    <xs:complexType>
                        <xs:sequence>
                            <xs:element name="coche" maxOccurs="unbounded">
                                <xs:complexType>
                                    <xs:sequence>
                                        <xs:element name="matricula" >
                                            <xs:simpleType>
                                                <xs:restriction base="xs:string">
                                                    <xs:pattern value="[0-9]{4}[A-Z]"/>
                                                </xs:restriction>
                                            </xs:simpleType>
                                        </xs:element>
                                        <xs:element name="propietario">
                                            <xs:simpleType>
                                                <xs:restriction base="xs:string">
                                                    <xs:pattern value="[A-Z][0-9]{2}"/>
                                                </xs:restriction>
                                            </xs:simpleType>
                                        </xs:element>
                                        <xs:element name="marca" type="xs:string"/>
                                        <xs:element name="modelo" type="xs:string"/>
                                        <xs:element name="color" type="xs:string"/>
                                        <xs:element name="km" type="xs:integer"/>
                                    </xs:sequence>
                                </xs:complexType>
                            </xs:element>
                        </xs:sequence>
                    </xs:complexType>
                </xs:element>
                <xs:element name="reparaciones">
                    <xs:complexType>
                        <xs:sequence>
                            <xs:element name="reparacion" maxOccurs="unbounded">
                                <xs:complexType>
                                    <xs:sequence>
                                        <xs:element name="matricula">
                                            <xs:simpleType>
                                                <xs:restriction base="xs:string">
                                                    <xs:pattern value="[0-9]{4}[A-Z]"/>
                                                </xs:restriction>
                                            </xs:simpleType>
                                        </xs:element> 
                                        <xs:element name="descripcion" type="xs:string"/>
                                        <xs:element name="fecha_entrada">
                                            <xs:simpleType>
                                                <xs:restriction base="xs:string">
                                                    <xs:pattern value="([0-9]{4})(/)([0-9]{2})(/)([0-9]{2})"/>
                                                </xs:restriction>
                                            </xs:simpleType>
                                        </xs:element>
                                        <xs:element name="fecha_salida">
                                            <xs:simpleType>
                                                <xs:restriction base="xs:string">
                                                    <xs:pattern value="([0-9]{4})(/)([0-9]{2})(/)([0-9]{2})"/>
                                                </xs:restriction>
                                            </xs:simpleType>
                                        </xs:element>
                                        <xs:element name="horas" type="xs:short"/>
                                    </xs:sequence>
                                    <xs:attribute name="codigo">
                                        <xs:simpleType>
                                            <xs:restriction base="xs:string">
                                                <xs:pattern value="[A-Z][0-9]{4}"/>
                                            </xs:restriction>
                                        </xs:simpleType>
                                    </xs:attribute>
                                </xs:complexType>
                            </xs:element>
                        </xs:sequence>
                    </xs:complexType>
                </xs:element>
            </xs:sequence>
        </xs:complexType>
    </xs:element>
</xs:schema>
